account_id,account_name,contact_name,activity_type,status,timestamp,comment
1044,Konmatfix,Scott Ashley,Email,Scheduled,1/2/2025,"I received an email from Scott Ashley indicating that Konmatfix is currently evaluating their options between our GTX Pro and GTX Basic models in light of recent advancements by NorthPeak. Scott underscored the urgency of finalizing the decision to ensure their supply chain enhancements remain on track with minimal disruption. He specifically mentioned the importance of aligning our MG Advanced integration timelines to support this decision.

To advance our efforts, we should arrange a meeting to discuss the proposed integration schedule and address any lingering technical concerns that could impact their timeline. Our technical team should be ready to provide detailed insights into how our solutions can be swiftly implemented to achieve their goals. By doing so, we can align our strategies more closely with Konmatfix's priorities and counter any influence NorthPeak might have. I’ll reach out to Scott to schedule this follow-up meeting and ensure we prepare a comprehensive presentation that highlights the unique benefits of our products and integration capabilities."
1044,Konmatfix,Scott Ashley,Email,Completed,3/4/2025,"Hi Scott,

I hope this message finds you well. I want to ensure we continue moving swiftly on aligning the MG Advanced integration with Konmatfix's supply chain optimization goals. It's critical that we address any remaining glitches to avoid disruptions as you consider our GTX models. Given NorthPeak's latest advancements, I understand the urgency in having a solid timetable to support your evaluation process.

I'm proposing a meeting early next week to discuss the technical challenges and finalize the integration schedule. This will allow us to dedicate the necessary resources and coordinate closely with your IT team. Please let me know your availability, and I'll make sure to arrange everything on our end. Looking forward to ensuring this process is as seamless and efficient as possible for your team.

Best regards,

[Your Name]"
1044,Konmatfix,Scott Ashley,Meeting,Completed,3/28/2025,"Follow-up meeting captured specifics, decisions, and action owners; recap to be shared by email.

(Additional context captured in a later message.)"
1044,Konmatfix,Scott Ashley,Meeting,Scheduled,4/19/2025,"During a productive Teams meeting with Scott Ashley, we finalized the integration schedule for MG Advanced. The discussion focused on aligning our technical efforts to mitigate previous challenges and ensure smooth implementation without interrupting Konmatfix’s supply chain operations. Scott expressed satisfaction with the proposed timeline, highlighting the need for seamless coordination with their IT department. Our team committed to providing on-site support during critical phases to address any potential glitches promptly.

Regarding GTX Basic, Scott indicated interest in recent feature updates and asked for more detailed documentation to compare with NorthPeak's offerings. We agreed to expedite this documentation and schedule a follow-up presentation to dive deeper into GTX’s competitive advantages. This upcoming session will also address any further questions their team might have. Our next step involves sending a comprehensive email briefing on today's decisions, including the detailed timeline and a meeting invite for the GTX presentation."
1045,Labdrill,Lynn Holmes,Email,Completed,1/12/2024,"Lynn reached out via email with inquiries surrounding potential opportunities for collaboration in the coming quarter. She expressed interest in exploring new solutions to enhance their operational efficiency and is particularly focused on evaluating options that align with their sustainability goals. Although no specific products have been mentioned yet, Lynn is seeking recommendations that can address both cost-effectiveness and innovation.

In response, I provided an overview of our latest offerings that emphasize eco-friendly practices without compromising performance. I suggested scheduling a video call next week to delve deeper into their requirements and tailor a demonstration that highlights how our solutions can meet their specific objectives. As an added value, I offered to share a relevant case study from a similar client to illustrate our successful implementation strategies. Awaiting Lynn's confirmation to finalize the meeting details and move forward collaboratively."
1045,Labdrill,Lynn Holmes,Meeting,Completed,3/13/2024,"During today’s onsite working session with Lynn Holmes, a productive dialogue centered around Labdrill’s current operational challenges and future sustainability goals. Lynn expressed interest in exploring solutions that would not only enhance operational efficiency but also align with their commitment to eco-friendliness. We discussed the potential for innovative approaches that could integrate seamlessly with their existing infrastructure.

To move forward, we agreed on the necessity of a tailored strategy that leverages our expertise in sustainability. Lynn suggested a follow-up meeting to dive deeper into specific requirements and explore case studies that demonstrate successful implementation in similar scenarios. Our next step is to prepare a detailed proposal incorporating these insights, scheduled for discussion next week. This will ensure we align our solutions effectively with Labdrill's objectives and continue building a robust partnership based on mutual growth and innovation."
1045,Labdrill,Lynn Holmes,Meeting,Completed,6/2/2024,"During today's Teams meeting, Lynn reached out seeking deeper insights into our approach for enhancing Labdrill’s sustainability efforts. The conversation pivoted towards understanding how our solutions can be seamlessly integrated with their current systems while maintaining eco-friendly standards. Lynn expressed interest in exploring how our previous implementations have successfully achieved similar objectives for other clients. 

We agreed to prepare a comprehensive proposal that highlights innovative strategies, with a focus on system compatibility and environmental benefit. This proposal will include detailed case studies showing measurable outcomes from our solutions. In terms of next steps, we will finalize this document and send it over for Lynn’s review by the end of next week. Additionally, we have scheduled a follow-up meeting for early the following week to gather more precise details on Labdrill’s operational needs and to ensure our proposal is closely aligned with their strategic goals. This will set a solid foundation for moving forward collaboratively."
1045,Labdrill,Lynn Holmes,Email,Scheduled,8/3/2024,"Hi Lynn,

I hope this email finds you well. We're putting the finishing touches on our proposal for your review. We have incorporated strategic, sustainable approaches that align with your operational goals, as discussed. Our focus is on how GTX Basic can seamlessly integrate into Labdrill's existing systems while enhancing efficiency and reducing environmental impact. We are particularly excited to highlight some case studies that demonstrate significant success with similar implementations, which should resonate well with your team's objectives.

We'll have the proposal ready by the end of the week, and I'm confident you'll find the tailored solutions compelling. Could we schedule a time early next week to go over the details together? This will give us a chance to address any questions and ensure our solutions perfectly meet your needs. Looking forward to moving ahead together.

Best regards,

[Your Name]"
1045,Labdrill,Lynn Holmes,Email,Scheduled,8/14/2024,"Lynn Holmes reached out via email to discuss further details about potential integration options with Labdrill's current infrastructure. They're specifically interested in how our solutions can seamlessly blend with their systems while enhancing overall sustainability. Lynn has requested additional data on our latest eco-friendly technologies and any recent innovations that could give them a competitive edge. They’re keen to see concrete evidence of cost-effectiveness and reduced environmental impact.

With this in mind, we'll promptly customize our proposal to emphasize these aspects and prepare detailed documentation to address their inquiries. Additionally, we'll include recent case studies that exemplify successful integrations with similar clients. Our focus remains on delivering a comprehensive strategy that aligns with Labdrill's values and strategic goals. The enhanced proposal will be sent by mid-week for review ahead of our scheduled follow-up meeting, ensuring Lynn and her team have ample time to evaluate our recommendations."
1045,Labdrill,Lynn Holmes,Email,Scheduled,10/17/2024,"Hi Lynn,

I trust this email finds you well. I wanted to update you that our team is finalizing the enhanced proposal, which emphasizes the eco-friendly technologies and integrations relevant to your goals. We've integrated data on recent innovations that align with Labdrill’s sustainability objectives, including detailed case studies demonstrating how similar implementations have benefited other clients. This will showcase the potential impact and adaptability of the GTX Plus Pro and GTK 500 within your existing framework.

We plan to send the completed proposal by Wednesday, ensuring you have sufficient time for assessment ahead of our follow-up meeting next week. This will allow us to address any questions or feedback you might have, refocusing our approach to meet your strategic needs. Please let us know if there's any additional information you would like us to include.

Looking forward to your thoughts.

Best regards,

[Your Name]  
[Your Position]  
[Your Contact Information]"
1045,Labdrill,Lynn Holmes,Meeting,Completed,10/29/2024,"During an insightful onsite working session, Lynn Holmes expressed keen interest in exploring how Labdrill can further leverage GTX Plus Basic and GTK 500 to align with their sustainability goals. She underscored the importance of seamless integration and requested specific insights on how these products can contribute to reducing their carbon footprint. 

Consequently, our team presented a customized proposal detailing innovative strategies and eco-friendly technologies tailored to Labdrill's unique requirements. Each component was backed by detailed case studies showcasing real-world applications and quantifiable environmental benefits. Lynn was particularly impressed by the potential efficiency improvements. We agreed to reconvene by mid-week to review the data more comprehensively, allowing Labdrill ample time for internal evaluation. This meeting will ensure they’re fully prepared for subsequent stages of decision-making, reinforcing our commitment to fostering a successful partnership."
1045,Labdrill,Lynn Holmes,Meeting,Scheduled,11/16/2024,"During today's onsite session, Lynn Holmes delved into the specifics of implementing our proposed solutions, particularly focusing on the GTX Plus Basic and GTK 500. Her keen interest centered on understanding how these technologies could meaningfully impact Labdrill’s operational sustainability. Lynn’s questions were insightful, targeting the practical steps for integration and potential ROI. Our team provided a detailed analysis, emphasizing how these products would streamline processes while minimizing environmental impact. We also discussed potential training sessions for Labdrill's staff to ensure a smooth transition.

In preparation for the mid-week follow-up, Lynn requested additional data on the emission reduction metrics associated with both GTX Plus Basic and GTK 500. Our team agreed to compile this information, enhancing the technical details in the existing proposal. This data will further strengthen Labdrill’s strategic planning, providing them with a robust framework for decision-making. The upcoming meeting will focus on reviewing these details and mapping out a timeline for potential implementation."
1045,Labdrill,Lynn Holmes,Meeting,Completed,1/27/2025,"During today's call, Lynn expressed enthusiasm about the planned follow-up meeting to delve deeper into the proposed emission reduction metrics. She highlighted the importance of aligning these metrics with Labdrill’s strategic sustainability targets. Her main concerns revolve around ensuring that the integration of GTX Plus Basic and GTK 500 aligns seamlessly with their existing infrastructure, without disrupting ongoing operations. She also emphasized the need for a clear timeline to avoid any delays that could impact their year-end sustainability goals.

To address these points, we agreed to come prepared with a detailed integration roadmap, highlighting key milestones and potential challenges. Lynn appreciates our proactive approach and looks forward to discussing the specific efficiency gains and environmental impacts these products can deliver. We will convene with our technical team to refine the roadmap before the mid-week meeting, ensuring we present a comprehensive plan that aligns with Labdrill’s objectives."
1045,Labdrill,Lynn Holmes,Meeting,Scheduled,2/2/2025,"After Labdrill's town hall, Lynn and I had a productive hallway chat where she shared further insights into their timeline expectations for the system integration. She reiterated their commitment to achieving substantial emission reductions by the end of Q2 and sought assurance that the proposed solutions would align seamlessly with their operation schedule. Lynn was particularly interested in how the GTX Basic could be optimized for their specific needs to minimize downtime during the rollout process. 

We agreed to arrange a detailed technical session next week to walk through the integration roadmap with our engineering team, ensuring that all timelines and potential challenges are addressed upfront. This session will also include a first draft of custom metrics aligned with Labdrill's sustainability targets—the foundation of our previous proposal. Lynn seemed satisfied with this approach, noting that clarity and precision are critical for her stakeholders. Moving forward, the goal remains to secure Labdrill’s confidence in our solution’s ability to meet their environmental initiatives without operational disruption."
1046,Lexiqvolax,John Charles,Email,Completed,1/4/2024,"I hope this message finds you well, John. We're reaching out following our recent discussions about optimizing your operations with our technology. Your interest in both the GTK 500 and the GTX Plus Pro aligns perfectly with the goals of boosting efficiency and reliability within your team. 

To address the specific needs you mentioned, the GTK 500 offers streamlined integration capabilities, while the GTX Plus Pro provides enhanced analytical features that could significantly benefit your data-driven strategies. We'd love to explore these possibilities further and discuss tailoring the implementation to your current infrastructure. 

Would you be available for a call later this week to delve into these options and address any questions you might have? This would also be an opportunity to ensure these products align with your broader objectives. Please let us know your availability, and we’ll do our best to accommodate. Looking forward to your insights and moving this partnership forward."
1046,Lexiqvolax,John Charles,Meeting,Completed,3/27/2024,"During our Teams conversation, John expressed interest in a deeper exploration of the MG Advanced, emphasizing its potential to enhance their current analytic capabilities beyond what's currently realized with the GTX Plus Pro. The discussion highlighted a particular focus on leveraging MG Advanced's robust data processing features to optimize their workflow analytics and operational forecasting. John inquired about integration specifics, especially concerning compatibility with their existing IT infrastructure, and the timeline for a seamless transition.

To address these points, it’s prudent to schedule a technical session with our integration specialist to assess their infrastructure's readiness and outline a step-by-step integration plan. This will ensure smooth deployment and alignment with their strategic objectives. Additionally, a follow-up meeting to present tailored use cases for the MG Advanced could effectively demonstrate its added value compared to their current setup. Scheduling these discussions is the immediate next step to ensure John's team is fully supported throughout the transition process."
1046,Lexiqvolax,John Charles,Meeting,Scheduled,6/20/2024,"Over dinner with John Charles and his associates, he expressed keen interest in further exploring the GTX Plus Pro, particularly its potential for enhancing real-time analytics while remaining streamlined for their operational demands. John also showed curiosity about integrating the MG Advanced to bolster data processing capabilities. The conversation shifted toward aligning these solutions with their key strategic objectives, emphasizing the need for a seamless transition to enhance efficiency without disruption.

The associates asked insightful questions about customizing the implementation process to fit their existing infrastructure. Our next step will involve coordinating a technical session where our specialists can evaluate their system's compatibility and propose tailored solutions. The objective is to ensure the deployment is smooth and maximizes their technological investments. We will follow up this week to arrange a convenient time for a deep dive into their current setup and to present potential use cases that align with their operational goals."
1046,Lexiqvolax,John Charles,Email,Scheduled,9/1/2024,"John,

Thank you for reaching out with your latest query regarding the potential integration of the GTX Plus Basic and MG Special into your current system. We understand the importance of effective real-time data analytics for your operations, especially given the capabilities of BlueHawk that you mentioned. To address this, we propose organizing a detailed technical session next week. This will enable us to delve deeply into your infrastructure and identify specific synergies that our products can bring to your setup.

During the session, our technical team will present tailored use cases to highlight how GTX Plus Pro and the MG Advanced can not only meet but exceed your data processing needs. The goal is to ensure that you receive a solution that enhances both operational efficiency and strategic forecasting. Please let us know your availability for this session, and feel free to share any additional requirements or considerations that need to be addressed. This will enable us to craft a comprehensive strategy that aligns perfectly with your objectives.

Looking forward to your feedback to finalize the arrangements. 

Best regards,
[Your Name]"
1046,Lexiqvolax,John Charles,Meeting,Completed,9/3/2024,"During a productive dinner meeting, John Charles, accompanied by two associates, expressed keen interest in deepening the integration of Lexiqvolax's current systems with our GTX Plus Basic and exploring potential upgrades to the GTK 500. The associates highlighted the importance of seamless data flow and improved analytics capabilities to optimize their operations. John emphasized that their team is particularly focused on enhancing forecasting accuracy and operational efficiency, making the real-time analytics of the MG Advanced an attractive prospect.

Our discussion revealed Lexiqvolax's need for a more comprehensive approach to system integration that prioritizes operational continuity. John seeks a targeted strategy to ensure the compatibility of their infrastructure with our solutions. To address this, we've agreed to organize a detailed technical session in the coming weeks. This session will involve our technical experts collaborating closely with their IT team to meticulously assess current systems and identify necessary adjustments for a smooth transition. Engaging in this collaborative groundwork will lay the foundation for an informed deployment strategy, aligning our offerings with their strategic objectives."
1046,Lexiqvolax,John Charles,Meeting,Completed,9/29/2024,"John Charles from Lexiqvolax reached out for a quick call to discuss recent insights regarding competitor offerings, particularly NorthPeak. He emphasized the importance of choosing a solution that not only meets their current operational demands but also positions them for future growth. During the call, John expressed heightened interest in understanding how the MG Advanced could enhance their data processing capabilities beyond what NorthPeak offers.

He requested a deeper dive into practical use cases and real-world scenarios where MG Advanced has proven beneficial. Recognizing the urgency, I assured him that our technical experts are ready to demonstrate these aspects in the upcoming session. In preparation, John agreed to provide additional specifics about their current data flow and analytics needs by the end of the week, allowing our team to tailor the session effectively. Ensuring alignment on these key areas will be crucial to solidify Lexiqvolax's confidence in our solutions over NorthPeak's."
1046,Lexiqvolax,John Charles,Meeting,Completed,12/22/2024,"Over lunch with John Charles, the discussion centered around the strategic advantages of the GTX Plus Pro, particularly in delivering real-time analytics and enhancing data processing capabilities. John expressed enthusiasm about the potential improvements these solutions could offer Lexiqvolax, highlighting their current challenges with data flow efficiency and the need for more robust forecasting tools. We delved into the specifics of their infrastructure, and John confirmed that he will share detailed data flow requirements by the end of the week. This information will enable us to create a bespoke demonstration that underscores the GTX Plus Pro's superior integration capabilities.

Our next step involves scheduling a follow-up session next Tuesday with Lexiqvolax's technical team. This will focus on demonstrating the tailored implementation strategy that addresses their unique needs, ensuring a solid preference for our offerings over the competition. A successful demonstration will strengthen Lexiqvolax’s confidence in our solutions, paving the way for further collaboration."
1046,Lexiqvolax,John Charles,Meeting,Scheduled,3/17/2025,"Over lunch near Lexiqvolax’s office, John Charles shared valuable insights into their immediate needs regarding data flow efficiency. He emphasized the importance of implementing a solution that not only integrates seamlessly with their existing systems but also enhances forecasting capabilities. John expressed keen interest in seeing how the GTX Plus Pro and MG Advanced could cater to these requirements, highlighting their unique data processing challenges. His input will be instrumental in tailoring our upcoming demonstration to align precisely with Lexiqvolax's operational goals.

As a next step, John will send over their detailed data flow requirements by the end of this week. This will allow us to customize the demonstration to showcase how our offerings outperform potential competitors, ensuring a compelling presentation to their technical team. Our objective remains clear: to illustrate the unmatched efficiency and integration our solutions provide, ultimately securing Lexiqvolax’s confidence in moving forward with us."
1046,Lexiqvolax,John Charles,Meeting,Completed,3/24/2025,"During today's call with John, he confirmed that Lexiqvolax's technical team is ready for the upcoming demonstration. They are particularly interested in how the GTX Plus Pro can enhance their data flow efficiency and are eager to see its integration capabilities in action. John has forwarded their detailed requirements, emphasizing the need for seamless analytics and advanced data processing. We agreed that the demonstration should not only highlight these features but also compare them to the current systems they have in place, particularly focusing on real-time data forecasting.

To ensure the presentation is tailored effectively, our technical lead will collaborate with their team next Tuesday to fine-tune the demonstration environment and address any additional technical queries. John expressed confidence in our solutions and seems keen to move forward swiftly once their team is satisfied with the demonstration. This alignment positions us strongly to secure Lexiqvolax's commitment and reinforces our competitive edge in delivering bespoke solutions."
1047,Massive Dynamic,Rhonda Martinez,Email,Scheduled,1/1/2024,"Thank you for our recent discussion regarding the MG Advanced suite and its potential impact on your operations. It was a pleasure learning more about Massive Dynamic’s innovative projects. I understand that there's interest in evaluating how our solutions might integrate, especially given your ongoing considerations with BlueHawk.

To facilitate a comprehensive comparison, I've attached a detailed feature analysis and some case studies of businesses in similar sectors that have successfully implemented MG Advanced. These resources should provide valuable insights into the system's capabilities and adaptability. Rhonda, please let me know if there are specific use cases or metrics you would like us to delve deeper into during our next meeting.

Looking forward to your thoughts on the materials, and I'll follow up next week to address any questions or to arrange a demo tailored to your team's objectives. Thank you once again for considering our solutions as part of your strategic initiatives."
