account_id,account_name,contact_name,activity_type,status,timestamp,comment
1021,Faxquote,Curtis Johnson,Meeting,Completed,10/14/2024,"During lunch with Curtis, the conversation transitioned smoothly to Faxquote's upcoming strategic initiatives and how our solutions fit into their broader vision. Curtis expressed renewed interest in GTX Plus Basic, specifically for enhancing operational efficiency, but voiced lingering concerns about potential disruptions during migration. The recent mention of OmniSuite applying pressure heightened his focus on competitive advantages, particularly our proven track record in seamless implementations.

I reassured Curtis by highlighting our robust integration capabilities and shared a high-level overview of a recent success story that closely parallels their situation, emphasizing quick turnaround and minimal downtime. Curtis appreciated the scenario, prompting him to request more detailed insights at our follow-up meeting. We agreed to prepare a tailored timeline for their integration, alongside a detailed security and feature comparison with NorthPeak and Aurelia. Closing the discussion, I confirmed the next meeting date, ensuring Curtis felt supported and confident moving forward."
1021,Faxquote,Curtis Johnson,Meeting,Scheduled,1/5/2025,"During the Teams meeting with Curtis, we presented the tailored integration timeline for the GTK 500, which aligns closely with Faxquote's operational goals. We also delivered a comprehensive security analysis, comparing our offerings against NorthPeak and Aurelia, emphasizing our robust data protection and adaptability. Curtis appreciated the granular approach and suggested focusing the upcoming follow-up meeting on the impact of GTK 500 on operational efficiency, specifically addressing seamless data migration. He expressed a keen interest in seeing case studies involving similar clients who successfully transitioned to our solution. Our team will prepare these case studies, highlighting how our adaptability led to improved outcomes. Additionally, Curtis mentioned the strategic pressures driven by OmniSuite, reinforcing the need for us to showcase distinct competitive advantages. We agreed to reconvene next week to dive deeper into these aspects, ensuring alignment with their strategic objectives."
1022,Finhigh,Scott Brown,Meeting,Completed,1/5/2024,"Over an engaging dinner with Scott Brown and two of his associates, we presented the GTX Pro and GTX Plus Pro, focusing on how they can streamline Finhigh’s operations. Scott showed particular interest in the enhanced analytics capabilities, especially given the recent initiatives their team is pursuing to optimize data-driven decision-making. However, NorthPeak was mentioned as a strong contender, with their solution's real-time integration feature being a notable selling point for Finhigh.

To address this, we highlighted our upcoming software update that enhances real-time data processing, which seemed to resonate well with Scott. The discussion suggested a willingness to explore further how GTX can align with Finhigh’s strategic goals. We agreed to arrange a follow-up demonstration next week, tailored to dive deeper into our products’ integration capabilities. Scott was keen to have his IT lead join the session to better assess the technical fit. Moving forward, coordinating with their IT team will be crucial to addressing any potential barriers and reinforcing the value proposition against NorthPeak."
1022,Finhigh,Scott Brown,Email,Completed,1/8/2024,"Following up on our initial conversation, I reached out to Scott Brown to address Finhigh's specific needs concerning GTX Plus Basic. We are focusing on a personalized demonstration that highlights our integration capabilities, especially given Finhigh's interest in data-driven optimization. Scott expressed the importance of ensuring seamless alignment with their current systems, which is a primary concern. 

I proposed coordinating a session with their technical team to dive deeper into how our solutions can mitigate these integration challenges effectively. Scott seemed interested in arranging this discussion and requested potential dates for a collaborative meeting. We need to prepare detailed examples of successful integrations with similar structures, emphasizing the flexibility and performance enhancements our platform provides. I will follow up with Scott early next week to finalize the meeting details and ensure their technical team is adequately briefed for a productive session."
1022,Finhigh,Scott Brown,Email,Scheduled,1/27/2024,"Follow-up meeting captured specifics, decisions, and action owners; recap to be shared by email.

(Additional context captured in a later message.)"
1022,Finhigh,Scott Brown,Meeting,Scheduled,3/27/2024,"During the onsite working session with Scott Brown and his technical team, our focus turned to addressing Finhigh's integration needs with precision. Scott expressed interest in understanding how MG Special and GTK 500 could optimize their current systems, particularly in comparison to solutions offered by BlueHawk. Our team provided a thorough demonstration highlighting the seamless integration capabilities and real-time data processing strengths of our products. By illustrating scenarios tailored to their IT infrastructure, we demonstrated clear alignment and flexibility unmatched by competitors. 

A significant part of the discussion revolved around data optimization, with Scott noting the potential to improve efficiencies substantially. The dialogue was productive, and Scott appreciated the depth of customization available. Moving forward, we agreed to follow up with a detailed proposal outlining how these solutions could be implemented effectively within Finhigh’s architecture. This proposal will include a timeline and key milestones for deployment. Additionally, we arranged a follow-up call next week with their technical lead to address any specific concerns and adjust our approach as needed to ensure a smooth integration process."
1022,Finhigh,Scott Brown,Meeting,Completed,4/21/2024,"In a brief call with Scott, we discussed the potential of GTX Plus Basic and GTX Basic to align with Finhigh's evolving IT strategy. Scott expressed a keen interest in understanding how these products can further enhance their current infrastructure, particularly in streamlining real-time analytics. He acknowledged the value of our solutions but pointed out the need for a robust demonstration that specifically addresses Finhigh's integration concerns. We agreed to schedule a demonstration tailored to Finhigh's system architecture, highlighting the seamless integration of our products. Following this, a detailed proposal will outline the implementation strategy, incorporating Scott’s feedback on the preferred timeline and milestones. The next step involves coordinating with their technical lead, ensuring all technical requirements are duly addressed. Scott appreciated our proactive approach and looks forward to the upcoming demo, anticipating it will provide the clarity needed for their decision-making process."
1023,Finjob,Melanie Landry,Email,Completed,1/1/2024,"Melanie reached out via email to discuss Finjob's current utilization of the GTK 500, expressing interest in optimizing certain features to better align with their recent workflow changes. She outlined specific areas where the team faced challenges and sought detailed guidance on customization options available to enhance productivity. Additionally, Melanie inquired about the potential benefits of integrating the GTX Plus Pro, particularly regarding its advanced data analytics capabilities, which could be pivotal for their upcoming projects.

In response, a comprehensive analysis of the customization potential for the GTK 500 was provided, focusing on the areas highlighted in her email. Furthermore, a detailed overview of the GTX Plus Pro's features and case studies demonstrating its successful application in similar scenarios were included to illustrate its capacity to meet Finjob’s needs. The next step involves scheduling a virtual meeting with our technical specialist to delve deeper into the solutions and conduct a brief demo of the GTX Plus Pro. This will ensure that Melanie and her team have all the necessary information to make well-informed decisions moving forward."
1023,Finjob,Melanie Landry,Meeting,Scheduled,2/25/2024,"During our dinner with Melanie and her colleagues, the focus remained on the benefits of integrating the GTX Plus Pro into their existing systems. The conversation centered around exploring how its advanced data analytics features could optimize Finjob's reporting capabilities, providing deeper insights and actionable intelligence for their teams. Melanie expressed particular interest in understanding how the customization options could be tailored to Finjob’s unique workflows, ensuring a seamless integration that maximizes productivity.

No significant blockers emerged during the discussion, but there was a clear interest in seeing a live demonstration to fully appreciate the system's potential. To advance this, we agreed to schedule a virtual meeting with our technical specialist, who will provide a comprehensive walkthrough of the integration process and customization capabilities. Melanie seemed optimistic about this next step and is eager to bring the added value of GTX Plus Pro to her team. The meeting is tentatively scheduled for early next week, allowing sufficient time for her team to formulate any additional questions they might want to address during the session."
1023,Finjob,Melanie Landry,Meeting,Scheduled,4/20/2024,"During today’s onsite working session, Melanie and her team actively engaged in a deep dive into the capabilities of the GTK 500. Their enthusiasm was evident as we explored specific use cases tailored to their operational needs, demonstrating the product's flexibility and potential to enhance efficiency. Melanie expressed particular interest in how the advanced data analytics could streamline their reporting processes, emphasizing the importance of seamless integration with their existing systems.

In anticipation of next week’s meeting, we agreed on preparing a comprehensive demonstration of the GTX Plus Pro, focusing specifically on integration scenarios and data handling features. This session will be co-led by our technical specialist, who will provide further insights and address any technical queries Melanie’s team might have. Additionally, she requested any available case studies showcasing successful integrations, which we will compile and send by the end of the week. This proactive step should bolster their confidence in moving forward and set the stage for potentially expanding our collaboration."
1023,Finjob,Melanie Landry,Meeting,Completed,7/6/2024,"During a brief call with Melanie, she expressed interest in scheduling the planned demonstration of the GTX Plus Pro's integration features. Melanie emphasized the importance of seeing how these features could directly enhance Finjob's current data analytics processes and reporting efficiencies. There's a strong focus on understanding how the product’s capabilities align with Finjob’s operational strategies. She requested that we tailor the demonstration to address specific integration scenarios unique to their workflows, which indicates a deeper commitment to optimizing their current systems.

Our technical specialist will reach out to coordinate timing for the demo and ensure it covers the requested specific use cases. This will provide Melanie and her team with a comprehensive view of potential impacts on their operations. To further support this, we'll furnish a couple of case studies showcasing similar successful integrations in their sector, which should solidify confidence in proceeding with our offerings. The next step is to finalize the demo schedule and prepare customized scenarios for their evaluation."
1023,Finjob,Melanie Landry,Email,Scheduled,9/7/2024,"In the latest email exchange, Melanie Landry requested further clarification on how GTX Plus Pro can specifically bolster Finjob's data analytics and reporting capabilities in contrast to PrimusTech’s offerings. Recognizing this as a critical decision point, we emphasized the superior integration flexibility and customization potential of GTX products, which can seamlessly align with Finjob's existing systems to drive more actionable insights. We proposed a virtual demonstration with our lead technical specialist to concretely illustrate these integration features, showcasing real-world examples of successful applications in similar industry settings.

To maintain momentum and address this pivotal concern, we suggested scheduling the demo session early next week. Melanie appreciated the proactive approach and agreed to finalize the timing by Friday, ensuring all relevant stakeholders are available to participate. This alignment will allow us to present targeted scenarios that resonate directly with their operational goals, strengthening Finjob's confidence in our capability to meet their reporting and analytics demands decisively."
1023,Finjob,Melanie Landry,Meeting,Completed,11/10/2024,"Melanie contacted us via Teams to affirm their interest in the upcoming virtual demo, highlighting the importance of focusing on the GTX Plus Pro’s data analytics capabilities. She specifically requested that we include use cases demonstrating improved reporting efficiencies, as these align closely with their operational objectives. This aligns well with our prepared material, emphasizing integration flexibility and practical application.

In preparation for the demo, we'll tailor our presentation to showcase scenarios relevant to Finjob's current analytics needs. We'll also prepare to provide detailed answers to any integration-related questions that may arise. Melanie will ensure that all relevant stakeholders are present, reinforcing the importance of this session. We anticipate finalizing all arrangements by Friday, with the goal of delivering a compelling demonstration that underscores our solutions’ strengths. Following the demo, a feedback loop will be initiated to address any further inquiries and solidify our position as a strategic partner."
1024,Funholding,Mr. Nicholas Moran,Email,Completed,1/5/2024,"Following the recent inquiry from Nicholas Moran, we received an email expressing his interest in upgrading their current GTX Plus Basic package. During the communication, Mr. Moran highlighted some features offered by Aurelia that he found appealing, particularly their advanced data analytics. While he acknowledged the strengths of GTX Plus, he expressed a desire to explore additional capabilities that could enhance their operational efficiency further. 

In response, we have proposed a tailored demonstration of the GTX Plus Advanced package, which includes the upgraded analytics features that meet his needs. This session would allow Mr. Moran to evaluate firsthand how the enhanced features differentiate from Aurelia's offerings. We have suggested scheduling this demo at his earliest convenience next week. This upgrade could streamline Funholding's processes significantly, and we are eager to align our solutions with their strategic objectives. Please confirm a suitable time for the demo or any other questions they might have, so we can move swiftly towards addressing their requirements."
1024,Funholding,Mr. Nicholas Moran,Email,Completed,3/22/2024,"Nicholas Moran reached out via email expressing increased interest in migrating to the GTX Plus Advanced package. He is particularly keen to understand how the upgraded features can align with their internal efficiency goals and support their expanding operational needs. With no competitors mentioned, the focus remains on differentiating our offering. We promptly scheduled a demo for next Tuesday afternoon to dig deeper into how the GTX Plus Advanced can specifically address Funholding's requirements. 

During the demo, we will emphasize the enhancement in data analytics and the seamless integration capabilities that can elevate their current systems. The goal is to address potential concerns and highlight the strategic advantages of our package. Following the demo, we plan to collect feedback from Mr. Moran and his team to tailor a proposal that best suits their business objectives. This step will ensure our solution not only meets but exceeds their expectations, strengthening our position as a key partner in their growth journey."
1024,Funholding,Mr. Nicholas Moran,Meeting,Completed,6/16/2024,"During today's Zoom meeting, Nicholas expressed keen interest in the advanced integration features of the GTX Plus Advanced package and how these could elevate Funholding's operational efficiency. He was particularly interested in the package's capability to enhance data analytics across their platforms, which aligns with their ongoing strategy to optimize performance metrics. Nicholas highlighted their need for a seamless transition and expressed some concerns about potential downtime during implementation. In response, our team assured him of our robust support infrastructure, designed to minimize disruptions and ensure a smooth upgrade process.

We proposed a customized roadmap to address these concerns, detailing steps for migration and support, which Nicholas found reassuring. He agreed to a follow-up session next week to delve deeper into technical specifics and potential timeline adjustments. This upcoming meeting will also serve as an opportunity to finalize the tailored proposal and further fortify our strategic partnership. Our objective is to ensure that the proposed solution not only meets their immediate needs but also supports future growth ambitions."
1024,Funholding,Mr. Nicholas Moran,Email,Completed,7/19/2024,"Following a productive email recap with Nicholas Moran, we are progressing with the detailed examination of the MG Advanced features that align specifically with Funholding’s strategic objectives. Nicholas expressed eagerness for the tailored analytics capabilities, and he's particularly focused on how these can streamline decision-making processes across departments. The main concern remains the potential downtime during implementation, despite the promising benefits.

To address this, we offered a preliminary look at our customized migration roadmap, emphasizing the minimal disruption to their operations. Nicholas seems receptive to this, and we discussed a potential timeline that harmonizes with their next fiscal quarter's goals. As a next step, we're scheduling a meeting next week with their tech team to fine-tune the migration details and ensure alignment on every front. This session will serve to solidify trust and demonstrate our commitment to seamless integration."
1024,Funholding,Mr. Nicholas Moran,Meeting,Completed,8/6/2024,"During our call with Nicholas Moran, he expressed enthusiasm about the upcoming meeting with Funholding’s tech team to delve deeper into the GTX Plus Pro's benefits. Nicholas is keen on understanding how the tailored analytics can enhance their current processes without disrupting workflow. He emphasized the importance of aligning the migration timeline with their upcoming product launches, highlighting a need for precision and minimal downtime.

In response, we assured him that our team is preparing a comprehensive, step-by-step migration plan, designed to ensure seamless integration. This includes potential phased rollouts tailored to Funholding’s release schedule. Nicholas agreed to provide preliminary launch timelines before the tech team meeting, allowing us to adjust our roadmap accordingly. Our next step involves finalizing this plan collaboratively with Funholding’s key decision-makers, reinforcing our commitment to their success."
1024,Funholding,Mr. Nicholas Moran,Email,Completed,9/11/2024,"Nicholas, thank you for your continued engagement and insights into aligning the GTX Plus Advanced package with Funholding’s product launch schedule. In our latest exchange, you highlighted the importance of seamless integration, and we’re focused on ensuring the migration roadmap addresses your specific needs for efficiency and minimal downtime. 

We’re currently finalizing the step-by-step plan and would appreciate the opportunity to collaborate with your tech team. Connecting with them will allow us to refine the phased rollouts to perfectly match your operational timelines. Could we schedule a meeting next week to discuss the specifics and ensure that our strategy aligns with your expectations? This session will be crucial for tailoring the migration process to support Funholding’s strategic goals and maintain operational excellence. Looking forward to your thoughts and coordinating with your team soon."
1024,Funholding,Mr. Nicholas Moran,Email,Scheduled,9/28/2024,"Following our recent discussions, Nicholas expressed a keen interest in refining the migration strategy to ensure seamless integration with Funholding's upcoming product launches. They are particularly enthusiastic about leveraging the capabilities of MG Advanced and GTX Pro to enhance their analytics and operational efficiency. During the email exchange, Nicholas highlighted the critical importance of minimizing potential downtime, emphasizing that any disruptions could directly impact their scheduled product rollouts. To address these concerns, a collaborative session with Funholding’s technology team is planned for next week. The objective is to dive deeper into their system architecture and tailor the migration roadmap to align perfectly with their timelines and operational demands. This engagement will also serve as an opportunity to introduce potential optimizations in the deployment phases, ensuring that Funholding achieves maximum benefit from our solutions. The team is committed to providing robust support throughout this process, reinforcing our dedication to their success."
1024,Funholding,Mr. Nicholas Moran,Meeting,Completed,10/21/2024,"Follow-up meeting captured specifics, decisions, and action owners; recap to be shared by email.

(Additional context captured in a later message.)"
1024,Funholding,Mr. Nicholas Moran,Meeting,Completed,12/5/2024,"Over lunch with Nicholas Moran near Funholding's office, we delved into finalizing the phased rollout strategy for the GTK 500 and MG Special. Nicholas reiterated the significance of a seamless integration with their product launch schedule, emphasizing that any misalignment could jeopardize their plans. We discussed the viability of implementing our proposed downtime minimization tactics, and Nicholas expressed confidence in the approach, provided we continue collaborating closely with their tech team. He also inquired about additional customization options to further tailor the GTK 500 to their specific operational demands, showing particular interest in functionalities that enhance data synchronization.

As a concrete next step, we agreed to arrange a tech workshop with key members from both teams to address these customization needs and fine-tune our migration strategy. This session will be crucial to align technical priorities and ensure that all migration nuances are scrupulously addressed. We will follow up with a detailed agenda and confirm the workshop schedule by mid-next week. Additionally, I assured Nicholas that a comprehensive recap of today’s discussion would be sent via email, outlining key points and next steps to maintain momentum."
1024,Funholding,Mr. Nicholas Moran,Meeting,Completed,3/3/2025,"After the town hall, I had a brief but productive chat with Nicholas in the hallway. He expressed enthusiasm about the upcoming tech workshop, particularly eager to dive deeper into how our MG Advanced can augment their current processes. Nicholas emphasized the importance of aligning our integration timeline with their internal calendar to prevent any operational hiccups during their peak periods. He suggested that during the workshop, both teams should prioritize addressing any potential bottlenecks in the data migration process to ensure a seamless transition.

I assured Nicholas that our team is committed to tailoring the integration to meet Funholding's specific needs, and we're prepared to tackle any challenges head-on. As a next step, I'll coordinate with our technical lead to prepare a preliminary discussion document that outlines potential focus areas for the workshop. This document will help in streamlining the sessions for maximum efficiency. I'll follow up with an email summarizing our conversation and attaching the document once it's ready, ensuring that all parties are prepared for the upcoming agenda."
1025,Ganjaflex,Taylor Sexton,Meeting,Scheduled,1/7/2024,"During today's onsite working session with Taylor Sexton, we explored their current operational challenges and began aligning our solutions to address key needs. Taylor was particularly interested in how our offerings could enhance their data integration and streamline internal processes. Despite being early in discussions, they expressed openness to exploring custom solutions that would suit their expanding requirements. 

To move forward, we agreed on a next step where our technical team will prepare a tailored presentation detailing potential product configurations that could fit Ganjaflex’s specific use cases. Taylor will coordinate internally to involve stakeholders from IT and operations in the next meeting to ensure all perspectives are considered. We scheduled a follow-up session for two weeks from today to present our findings and further explore collaborative opportunities."
