account_id,account_name,contact_name,activity_type,status,timestamp,comment
1062,Silis,Briana Collins,Email,Scheduled,2/23/2024,"Subject: Scheduling Our Upcoming Workshop

Hi Briana,

Thanks for reaching out. We're thrilled to proceed with arranging the virtual workshop to delve into the MG Advanced functionality with your team. To streamline its integration and ensure everyone is on the same page, we propose conducting the workshop during the first week of next month. This timing should suit the majority of your team and align with your deployment timeline. Please let us know your preferred dates within that week and the team members you'd like to include. We'll ensure the workshop covers both system integration strategies and hands-on training tailored to your team's specific needs.

Looking forward to your confirmation so we can finalize the logistics. Please feel free to indicate any additional topics or questions you think we should prepare for in advance of our session.

Best regards,

[Your Name]  
[Your Position]  
[Your Contact Information]"
1062,Silis,Briana Collins,Meeting,Scheduled,3/17/2024,"During a brief call with Briana Collins, she expressed eagerness to advance the integration process for MG Advanced, focusing on its seamless adoption within Silis. She emphasized the importance of aligning stakeholder knowledge with the system's capabilities before deployment. We agreed on the necessity of customizing the upcoming virtual workshop to address specific operational challenges faced by their technical team. Briana highlighted a preference for interactive training modules that can directly demonstrate integration strategies. We also discussed potential dates for the workshop and agreed to provisionally schedule it for the second week of November. Before finalizing, Briana will confer with her team to ensure full attendance. I will follow up next Tuesday to confirm the chosen date and begin organizing the session's agenda to suit their needs. This will facilitate a smooth adoption and help achieve the desired outcome of deploying the system by the end of the quarter."
1062,Silis,Briana Collins,Meeting,Scheduled,3/26/2024,"Briana initiated a brief call to brainstorm potential agenda items for the upcoming virtual workshop focused on MG Advanced. She emphasized the importance of dedicating a portion of the session to address specific integration pain points identified by Silis’ technical team. To facilitate a more customized experience, Briana suggested incorporating interactive case studies that simulate real-world scenarios encountered during their system integration process. She mentioned that her team would benefit greatly from a segment on troubleshooting common issues, ensuring they're equipped to handle minor disruptions independently. 

It was agreed that a follow-up conversation would be necessary to finalize these details and confirm participant availability. I proposed coordinating this discussion early next week to align all stakeholders and solidify the workshop's framework. Additionally, I reassured Briana that we would provide the tailored content and resources needed for a seamless transition and successful training outcome."
1062,Silis,Briana Collins,Email,Scheduled,6/9/2024,"Hello Briana,

Thank you for reaching out and sharing your latest insights. We're thrilled to proceed with our planned initiatives to ensure Silis capitalizes on the full potential of GTX Pro and GTX Plus Pro. The upcoming virtual workshop is set to cover your key needs, especially focusing on resolving any integration challenges. As we're keen to finalize the agenda and participant list, could you confirm your team's availability for the second week of November? This will enable us to tailor the interactive modules more effectively to match your team's requirements. Additionally, if there are any specific areas of concern or topics you'd like us to address more thoroughly, please feel free to share these insights. Our goal is to support a smooth transition while aligning the system capabilities with your strategic objectives. Looking forward to your feedback.

Best regards,  
[Your Name]"
1062,Silis,Briana Collins,Meeting,Completed,8/8/2024,"We connected with Briana via Teams to discuss the upcoming virtual workshop for Silis' MG Advanced integration. She expressed enthusiasm about the planned interactive modules and case studies, recognizing their potential to directly address Silis’ specific integration challenges. Briana indicated that the technical team is eager to engage and gain deeper insights into system capabilities. Additionally, she confirmed participant availability for the workshop, aligning schedules to maximize attendance and benefit. During our discussion, it became apparent that further aligning stakeholder understanding with system functionalities remains a crucial step. Briana suggested a preliminary session to introduce the GTK 500 functionalities, ensuring her team is well-prepared for more advanced training during the workshop.

Our next step is to schedule a brief introductory session next week to familiarize the team with GTK 500. This will set a solid groundwork, enabling them to fully engage with the advanced training sessions. We’ll touch base with Briana again to finalize logistics and ensure all necessary materials are prepared in advance."
1062,Silis,Briana Collins,Meeting,Completed,10/4/2024,"During today’s Teams call, Briana Collins expressed interest in scheduling the introductory session on GTK 500 functionalities next Tuesday. The objective is to equip Silis' technical team with foundational knowledge ahead of our November workshop. Briana emphasized the importance of this session to facilitate a smoother integration process, allowing the team to engage more effectively in upcoming training modules. 

We agreed to send over the agenda and any preliminary materials by the end of this week, ensuring participants have ample time to review. Additionally, Briana indicated that a couple of new team members might join, necessitating some basic orientation on the system. Arrangements will be made to include this in our upcoming session. Meeting these immediate needs is crucial, as it sets the stage for our broader integration goals. I’ll follow up with Mary in logistics to confirm the virtual setup and will ensure all technical checks are in place, minimizing any disruptions."
1062,Silis,Briana Collins,Meeting,Scheduled,12/2/2024,"During today’s Teams meeting, Briana highlighted a new consideration: PrimusTech's recent webinar has sparked interest among a few team members, prompting questions about their feature set compared to MG Advanced. This presents an opportunity to reinforce our differentiators ahead of the upcoming GTK 500 session. Briana is keen to ensure that we address these concerns while fortifying Silis's confidence in our tailored integration solution. She suggested incorporating a brief comparison segment during next week’s session to clarify any doubts and preempt further interest in competitors.

To address this, we will provide a comparative analysis that highlights how MG Advanced excels in the areas critical to Silis’s objectives, especially focusing on integration ease and support infrastructure. Coordination with our technical lead to incorporate these elements into the session is planned. This will help maintain momentum towards the November workshop, ensuring that the team’s focus remains aligned with our deployment goals. Briana will also facilitate a Q&A to ensure all team queries are thoroughly addressed."
1062,Silis,Briana Collins,Email,Completed,1/21/2025,"Following up on Briana Collins’ proactive engagement, we've advanced preparations for the GTK 500 functionality session. Our agenda will now include an in-depth comparative analysis, addressing recent queries about PrimusTech’s offerings, ensuring we highlight the strategic advantages of MG Advanced. The interactive modules planned for the November workshop will further provide hands-on experience, which Briana has emphasized as pivotal for their technical team's adaptation.

To ensure a seamless integration process, we'll conduct a comprehensive dry run next week, focusing on logistics and technical readiness for the virtual setup. All materials are being finalized, and any additional requirements should be communicated by the end of this week. Your team’s feedback on the session's outline will be invaluable, and we encourage any preliminary questions to enhance the forthcoming workshops. Once confirmed, we look forward to delivering a session that not only meets Silis's integration needs but also sets a strong foundation for our continued collaboration."
1062,Silis,Briana Collins,Meeting,Scheduled,2/8/2025,"During the onsite working session with Briana, the conversation focused on fine-tuning the upcoming GTK 500 functionality session. She emphasized the need to ensure the technical readiness of their team, aligning with their broader integration goals. Discussions pivoted towards comparing MG Advanced with PrimusTech, where Briana expressed a growing interest. To address this, we outlined a plan to present a detailed comparative analysis, emphasizing the long-term benefits of MG Advanced and its superior integration capabilities with their existing systems.

To maintain momentum, we agreed to prepare a comprehensive set of materials for both the upcoming session and the broader workshop in November. This includes interactive modules and case studies tailored to address specific integration challenges. Briana will confirm participant availability by the end of the week, enabling us to proceed with logistical arrangements for the virtual setup. Our next step involves coordinating with her team to ensure all technical infrastructures are in place, reinforcing a seamless transition and underscoring MG Advanced's distinctive advantages."
1063,Singletechno,Richard Roy,Meeting,Completed,1/8/2024,"During a brief call with Richard Roy, an opportunity arose to explore potential synergies between Singletechno's evolving tech initiatives and our product portfolio. Richard expressed keen interest in discovering solutions that can streamline their internal processes and enhance productivity. While specific products were not discussed, there is a clear interest in platforms that offer flexibility and scalability.

Our discussion set the stage for a more detailed follow-up meeting where we can present tailored solutions aligned with their needs. To prepare, we will craft a presentation featuring our most relevant offerings and use cases that resonate with Singletechno's objectives. Next steps include scheduling this in-depth session within the next two weeks and ensuring Richard has access to preliminary materials for review. This engagement holds promising potential to establish a partnership that supports Richard's vision for innovation and efficiency."
1063,Singletechno,Richard Roy,Meeting,Scheduled,3/14/2024,"During our latest Zoom interaction with Richard Roy from Singletechno, the discussion centered on understanding their critical operational challenges and how our solutions could provide value. Richard expressed a keen interest in exploring platforms that not only enhance scalability but also seamlessly integrate with existing systems. He brought up NexCore, highlighting their recent deployment of a flexible platform that has gained traction among similar tech firms. This underlined the urgency of differentiating our solutions by emphasizing our unique features and adaptability.

To capitalize on this interest, our next step involves crafting a customized proposal that includes specific use cases illustrating how our solutions address their pain points. We agreed to schedule a follow-up meeting in two weeks, where this detailed presentation will be shared. It’s crucial to articulate a compelling case that not only matches but exceeds what our competitors offer. Coordination with the product development team will be essential to refine the proposal and ensure it aligns with Singletechno's technology strategy."
1063,Singletechno,Richard Roy,Meeting,Completed,6/11/2024,"Following a productive town hall, I had an impromptu conversation with Richard Roy in the hallway, where he candidly shared that Singletechno is keen to explore options that will not only enhance current processes but also ensure integration without disrupting existing workflows. Richard expressed particular interest in the adaptability of the GTX Plus Basic for their rapidly evolving infrastructure. He was receptive to diving deeper into how the MG Special might address specific scalability concerns they are facing.

In response, I assured Richard that our next steps involve leveraging insights from this conversation to tailor a proposal that explicitly addresses their unique needs, focusing on differentiation and integration. I proposed organizing a detailed presentation within the next two weeks and suggested setting a definitive date for a follow-up meeting. Richard agreed that aligning closely with their upcoming project timeline is critical. I will coordinate with the product development team to refine our solutions, ensuring we present an impactful case that underscores our competitive edge. Planning to send out a calendar invite by early next week to confirm the meeting and move forward strategically."
1063,Singletechno,Richard Roy,Email,Scheduled,7/26/2024,"I appreciate the insights Richard offered regarding Singletechno's integration and scalability goals. With this in mind, I've collaborated closely with our product development team to tailor a proposal centered on the GTX Plus Pro. This solution will address their pressing concerns and ensure compatibility with their current infrastructure without sacrificing flexibility. Our proposal emphasizes adaptability to support their anticipated growth trajectory and will include specific integration case studies that highlight our advantages.

To solidify our partnership and further elaborate on these tailored solutions, I suggest scheduling a follow-up meeting in the next two weeks. During this session, I will present a comprehensive overview of the GTX Plus Pro's capabilities, focusing on how it can effectively meet Singletechno's needs and outpace alternative options in adaptability. Please let me know your availability for this meeting; I am committed to making this collaboration a seamless success."
1063,Singletechno,Richard Roy,Email,Scheduled,7/30/2024,"Following our recent discussions, it's clear Singletechno is at a pivotal moment regarding its technology infrastructure. We believe the GTK 500, with its robust adaptability, perfectly aligns with the integration needs Richard mentioned, providing a seamless transition without impacting their current workflow. Additionally, when considering the MG Special, our advanced features distinctly set us apart from NexCore, particularly in scalability and customizability, which are critical for supporting their growth objectives.

To further explore these synergies, we should coordinate a detailed presentation, ideally within the next two weeks. In this session, we can delve deeper into how our solutions not only meet but exceed Singletechno's requirements for scalability and differentiation. Aligning our technologies with their strategic goals will reinforce Singletechno's market position and enhance operational efficiency. I'll reach out to Richard shortly to lock in a convenient date, ensuring we can provide a comprehensive overview tailored to their specific needs and highlight our competitive advantages effectively."
1063,Singletechno,Richard Roy,Meeting,Completed,8/17/2024,"During a brief call with Richard Roy, he expressed continued interest in the GTX Plus Basic but sought clarity regarding its comparative advantages over the GTX Basic. Richard emphasized the importance of understanding how these products could enhance Singletechno's operational workflows without added complexity. He also shared insights about upcoming projects requiring immediate attention, suggesting that any solution must demonstrate a tangible impact on efficiency and scalability.

To address these points, we agreed to arrange a meeting within the next week to dive deeper into the capabilities of both GTX Plus Basic and GTX Basic. This session will include an in-depth demonstration, focusing on features that align with their needs for seamless integration and adaptability. We'll highlight specific use cases relevant to their industry and offer examples of how these products can be leveraged for upcoming projects. The goal is to equip Singletechno with the necessary information to make an informed decision that propels their growth trajectory. Richard assured us of his team's availability to ensure a comprehensive discussion."
1064,Sonron,Deanna Bell,Email,Scheduled,1/21/2024,"Deanna Bell reached out via email seeking insights into scalable solutions that could enhance Sonron's operational efficiency. Her inquiry focused on potential pain points in their current systems, specifically regarding workflow automation and data integration. Although no specific products were mentioned, it's evident they're exploring options to streamline processes and boost productivity.

To address Sonron's needs effectively, we should set up a detailed consultation to assess their existing infrastructure. This will help identify areas where our services could offer significant improvements. I'll suggest a call with our solutions architect to dive deeper into their requirements and tailor a proposal that aligns with their strategic goals. 

I'll reply to Deanna, recommending a convenient time for a conversation next week and asking if there are any particular aspects of their operations she wants us to focus on. This will ensure our recommendations are directly aligned with their needs and strategic vision."
1064,Sonron,Deanna Bell,Meeting,Scheduled,4/7/2024,"During a Teams meeting initiated by Deanna Bell, Sonron expressed enthusiasm about moving forward with our GTX Plus Basic solution, especially in the context of improving their data integration processes. Deanna highlighted an interest in leveraging automation to enhance workflow efficiency and requested further details on how MG Special can complement their existing system architecture. She noted their priority is to seamless integrate these solutions without disrupting current operations.

Our next step is to schedule a call with our solutions architect to explore these interests further and ensure a tailored approach. Deanna is particularly keen on understanding the specific integrations and customizations possible with GTX Plus Basic to meet their strategic objectives. We agreed to set up this call early next week, allowing Sonron to gather any additional internal feedback. This will help us deliver a proposal that aligns perfectly with their operational goals."
1064,Sonron,Deanna Bell,Email,Completed,6/3/2024,"Deanna reached out via email requesting specific details on how our GTX Pro can enhance their current data integration processes. She expressed an interest in understanding the customization possibilities that could specifically address Sonron’s goal of achieving seamless, non-disruptive integration with their existing infrastructure. In response, I provided tailored insights into the GTX Pro’s scalable integration capabilities and offered to facilitate an in-depth technical session to walk through potential customization features. This would ensure the solution aligns with their operational objectives and strategic vision.

Further, I proposed scheduling this session ahead of the upcoming call with our solutions architect to ensure that we are fully aligned on technical specifications and integration scenarios before diving into broader architectural discussions. Awaiting confirmation from Deanna on her availability to proceed with this approach. This meeting will be crucial for addressing any potential blockers and refining our proposal to better support Sonron’s strategic initiatives."
1064,Sonron,Deanna Bell,Meeting,Completed,7/10/2024,"During today's Teams session, Deanna Bell provided her availability for the proposed technical session, which is now scheduled for next Tuesday. This meeting will focus on tailoring the GTX Plus Basic to Sonron's specific data integration and workflow needs. Deanna expressed interest in understanding how the GTX Plus Basic compares in capabilities to the MG Special, specifically regarding seamless integration without disrupting current operations. This session will be crucial in addressing these questions and refining our integration strategy.

To ensure a productive discussion, our solutions engineer will prepare a comparative analysis of both products, highlighting integration capabilities and customization options. Following this, the session will serve as a precursor to the call with our solutions architect, allowing us to come prepared with a well-defined strategy aligned with Sonron's goals. Deanna's proactive engagement underscores the importance of addressing these technical concerns promptly to facilitate a smooth decision-making process."
1064,Sonron,Deanna Bell,Meeting,Scheduled,9/28/2024,"Deanna and I connected over Teams to delve into how GTK 500 and MG Advanced could align with Sonron’s strategic objectives. Deanna expressed concerns about PrimusTech’s recent proposal, emphasizing their competitive pricing and claimed seamless integration. We explored the distinctive integration capabilities of our solutions, specifically how GTK 500 could enhance their current systems without the disruptions Sonron fears. Highlighting the customization flexibility that MG Advanced offers was also crucial, given its potential to surpass PrimusTech’s offerings. Deanna was particularly interested in a deeper dive into our integration processes ahead of next Tuesday’s technical session.

We agreed that our solutions engineer would prepare a tailored analysis, focusing heavily on customization and ease of integration to address any lingering uncertainties before the critical technical session. This analysis will serve as a bridge to the forthcoming solutions architect call, ensuring Sonron's decision-making process is well-informed and aligned with their efficiency goals."
1064,Sonron,Deanna Bell,Email,Completed,12/7/2024,"Deanna reached out via email to inquire about the potential for enhanced customization within the GTX Pro, specifically regarding integration capabilities with their existing systems. She emphasized the critical need for a seamless transition to avoid operational delays, aligning with their overarching goal of increased efficiency. The upcoming technical session remains a pivotal opportunity to address these needs, especially in light of emerging priorities for scalable customization.

To ensure her questions are thoroughly addressed, we’ll provide a detailed walkthrough of the GTX Pro’s integration features. Our solutions engineer will tailor this to highlight direct benefits and differentiation points versus the GTK 500 and MG Advanced. We plan to deliver a comparative analysis emphasizing ease of integration, promising operational stability during the transition. Additionally, we'll prepare to discuss any specific cases where similar implementations have been successfully executed, further reinforcing confidence in our solution. This proactive approach seeks to solidify Sonron's perception of our offering as the most aligned with their unique requirements."
1064,Sonron,Deanna Bell,Meeting,Completed,2/7/2025,"During our Teams meeting, Deanna Bell expressed interest in scheduling a detailed demonstration to further explore GTX Pro’s integration capabilities. Addressing her focus on enhanced customization and a smooth transition, our solutions engineer offered to showcase specific use cases that highlight operational stability and successful implementations. Deanna appears committed to finding a solution that not only meets their current needs but also scales effectively with future projects.

As a next step, we agreed to coordinate a comprehensive demo session next Tuesday, ensuring all technical queries are addressed ahead of their internal review. Additionally, Deanna requested documentation detailing GTX Pro’s compatibility and advantages over GTK 500 and MG Advanced, emphasizing their priority on seamless integration and cost-effectiveness. Following the demo, we plan to review any remaining concerns she or her team might have, solidifying our position as their preferred choice for implementation."
1065,Stanredtax,Alexandra Yoder,Email,Scheduled,1/12/2024,"Thank you, Alexandra, for reaching out regarding your interest in MG Advanced. It was insightful to understand your current goals and how our platform could support your initiatives. We discussed some key functionalities of MG Advanced that align with your objectives, including enhanced data integration capabilities and customizable reporting features. I understand that streamlining these processes is critical for your upcoming projects.

To ensure that MG Advanced meets all your requirements, shall we arrange a further demonstration tailored to your specific use cases? It would allow us to dive deeper into the platform's potential benefits and address any unique challenges your team might face. Please let me know your availability for a virtual meeting next week. Looking forward to the opportunity to collaborate more closely and support Stanredtax in achieving its strategic goals."
