account_id,account_name,contact_name,activity_type,status,timestamp,comment
1000,Acme Corporation,Paul Stokes,Meeting,Completed,1/31/2024,"Engaged in a brief call with Paul Stokes to discuss the MG Special and its potential fit for Acme Corporation's current needs. Paul expressed interest in the product’s unique features, particularly its integration capabilities, which align well with their ongoing project to improve internal workflows. He noted that streamlining these processes is a priority for the coming quarter. There were no immediate blockers identified; however, Paul mentioned the importance of a seamless onboarding experience for their team.

To move forward, I suggested a product demonstration tailored to showcase the MG Special’s specific advantages pertinent to their objectives. Paul agreed that a more detailed presentation involving their technical team would be beneficial. We scheduled a demo session for next Thursday at 2 PM, where the focus will be on operational efficiency and ease of integration. I'll coordinate with our technical support to address any potential concerns that might arise during the demonstration."
1000,Acme Corporation,Paul Stokes,Email,Scheduled,2/27/2024,"In today's email exchange, Paul Stokes expressed keen interest in exploring how the advanced integration capabilities of our MG Special could enhance Acme’s internal workflows. He has confirmed that key members of their technical team will attend Thursday’s demonstration. Paul specifically requested that the session highlight real-world scenarios where the MG Special has successfully streamlined operations for similar organizations, emphasizing their interest in tangible outcomes.

To align with their expectations, our technical support team is preparing illustrative case studies and real-time examples that underscore the MG Special's efficacy. Additionally, they will focus on how a seamless integration process can be achieved, ensuring minimal disruption during the transition. Paul also mentioned the importance of understanding any potential impact on existing systems, to which we will be prepared to provide detailed insights.

Ahead of the meeting, ensure that any specific technical queries from Acme are compiled so that our team can address these directly during the demonstration. This tailored approach will be pivotal in showcasing the MG Special as an ideal fit for their operational goals."
1000,Acme Corporation,Paul Stokes,Meeting,Completed,5/6/2024,"Following the town hall, Paul and I had a constructive hallway chat where he expressed optimism about the upcoming demonstration. He appreciated our proactive approach in preparing real-world examples and reiterated the significance of the technical team's involvement. Paul is keen to ensure that the demonstration covers how the MG Special can substantively enhance their existing workflows without disruption. He mentioned that the team is particularly interested in how we have supported other corporations with similar operational frameworks, emphasizing the importance of smooth integration.

To solidify confidence before Thursday, I suggested a brief preliminary call with their technical leads to clarify any last-minute technical questions. This step will allow us to refine our presentation based on their immediate concerns. Paul agreed, and we will coordinate this call for tomorrow afternoon. Our objective remains clear: demonstrate the seamless integration and the strategic advantages of the MG Special to their operations."
1000,Acme Corporation,Paul Stokes,Meeting,Completed,6/2/2024,"The onsite working session with Acme Corporation proved to be both collaborative and insightful. The team, led by Paul Stokes, displayed keen interest in the detailed presentation of MG Advanced and GTX Pro, focusing on the integration capabilities critical to their operational strategy. Key concerns centered around how these products could elevate their current workflow without disrupting existing systems. In response, we provided specific case studies that illustrated successful implementations in similar industries, fostering a clear understanding of potential benefits.

During the session, Paul identified several areas where seamless integration could advance their objectives and offered valuable feedback on additional features that would enhance user experience. The team's enthusiasm highlighted a strong alignment between our offerings and their goals. As a next step, we agreed to set up a follow-up meeting next week to dive deeper into technical specifications, ensuring alignment with their internal requirements. In preparation, our technical team will prepare a targeted list of enhancements that respond to Acme's feedback, ensuring the upcoming meeting is as productive as possible."
1000,Acme Corporation,Paul Stokes,Email,Scheduled,7/12/2024,"Paul,

We're looking forward to our upcoming meeting with your team to discuss the technical specifications crucial to Acme Corporation’s integration goals. Our technical team has been diligently preparing enhancements tailored to your specific needs, ensuring that the onboarding of MG Advanced and GTX Pro is as seamless as possible. 

We've also reviewed the positive feedback from our last session. It underscores the significance of maintaining stability within your existing systems, which remains a top priority for us. To facilitate a more productive discussion, we’re compiling a detailed technical brief that outlines how these integrations can elevate your current workflows without causing disruptions. This will be shared with you ahead of our meeting so that any additional questions or insights your team might have can be addressed promptly. 

Please let us know if there are any particular areas you would like us to focus on during the meeting. We're committed to aligning closely with Acme's strategic objectives and ensuring that this collaboration drives tangible results.

Looking forward to your thoughts.

Best regards,

[Your Full Name]
[Your Position]"
1000,Acme Corporation,Paul Stokes,Meeting,Scheduled,8/12/2024,"During a brief call, Paul Stokes expressed enthusiasm about the upcoming session focused on technical specifications. He noted that Acme's internal review of prior materials highlighted a few key areas where integration capabilities could significantly enhance their workflow. Paul mentioned specific interest in how our offerings can adapt to scalable implementations without requiring dramatic overhauls to their existing systems. This aligns well with our preparation around the MG Advanced and GTX Pro features.

To ensure the next steps are as productive as possible, our technical team will present detailed integration scenarios, demonstrating seamless adaptation within Acme's operational context. Paul suggested scheduling another touchpoint post-meeting to address any emerging concerns or additional requirements. The team is aligning resources to provide clear demonstrations to facilitate an informed decision-making process. This approach promises not only to meet Acme's immediate needs but also to foster a long-term partnership as we tailor our solutions to their evolving strategic goals."
1000,Acme Corporation,Paul Stokes,Email,Completed,9/1/2024,"Paul,

Thank you for your continued interest in GTX Plus Pro. Based on our previous discussions, we've tailored our upcoming meeting to fully address Acme Corporation's requirements, particularly emphasizing seamless integration without the need for a complete system overhaul. Our technical team has prepared comprehensive integration scenarios that highlight how GTX Plus Pro can enhance workflow efficiency while ensuring stability within your current infrastructure.

We've noted PrimusTech's presence in your considerations, so our session will include a detailed comparison to showcase the advantages of choosing our solutions, focusing on scalability and ease of implementation. Please let me know if there are specific areas you want us to delve deeper into during the meeting. Looking forward to an engaging discussion that sets the stage for a robust partnership.

Best regards,

[Your Name]  
[Your Position]  
[Your Contact Information]"
1000,Acme Corporation,Paul Stokes,Email,Completed,10/14/2024,"Paul,

Thank you for expressing interest in exploring our GTX Basic solution further. I'm pleased to schedule a detailed session where we can dive into the specific integration scenarios most relevant to Acme's objectives. Given that scalability without overhauls is a priority for you, we have prepared several examples showcasing how GTX Basic can seamlessly integrate with your existing systems, ensuring minimal disruption and maximum efficiency.

During our upcoming discussion, we’ll also examine how our approach compares to competitors like Aurelia, accentuating the advantages in terms of ease of implementation and future scalability. Additionally, our technical team is ready to address any particular concerns or requirements you might have, ensuring we tailor the session to your specific needs.

Please let me know your availability for next week, or if there is anything specific you’d like us to prepare in advance. Looking forward to collaborating closely to find the best path forward for Acme.

Best regards,

[Your Name]
[Your Position]"
1000,Acme Corporation,Paul Stokes,Email,Scheduled,11/29/2024,"Following a comprehensive email exchange, we delved deeper into Acme Corporation's integration objectives and their emphasis on solutions that prioritize scalability and minimal disruption. Paul Stokes highlighted a keen interest in exploring the advanced capabilities of the GTX Pro, particularly in relation to their existing workflows. His inquiry into our integration methods provided a valuable opportunity to underscore the unique advantages our systems offer over OmniSuite, such as seamless user transition and enhanced operational stability.

To maintain momentum, we proposed a live demonstration session tailored to showcase the potential of both MG Special and GTX Pro in achieving Acme's goals without necessitating major overhauls. This session will offer a comparative analysis against OmniSuite, highlighting ease of implementation and our commitment to customized support. We're coordinating with the development team to ensure all technical queries can be addressed in detail. Looking ahead, confirming a suitable time for this demonstration with Paul will be crucial, paving the way for a decision that aligns with both immediate needs and long-term strategy."
1000,Acme Corporation,Paul Stokes,Email,Completed,12/28/2024,"I appreciate your engagement, Paul, as we explore how our offerings can align with Acme Corporation's needs. Based on our recent discussions, it's clear that tailoring a solution like GTX Pro could significantly enhance your workflow efficiency by focusing on seamless integration and robust system stability. Considering your interest in scalable solutions, I suggest scheduling a live demonstration next week to delve into the capabilities of GTX Pro and precisely how it can be tailored to meet Acme's specific requirements. This session will also provide an opportunity to address any technical inquiries and compare its advantages over OmniSuite, ensuring minimal disruption during integration.

To streamline this process, I'll coordinate with our development team to ensure all relevant resources and technical experts are on hand to make the demonstration as informative and productive as possible. Please let me know your availability for this session, and we'll take care of the rest. Looking forward to advancing our collaboration."
1001,Betasoloin,Joel Woods,Meeting,Completed,1/20/2024,"Over a relaxed dinner with Joel Woods and two of his associates, we explored the evolving needs within Betasoloin that could be addressed by our MG Advanced solutions. Joel expressed enthusiasm about enhancing their current systems to better handle their expanding data management requirements, highlighting an urgent need for robust scalability. The discussion turned toward specific features of MG Advanced that enable seamless integration with their infrastructure, which was a pivotal point for his team.

Feedback from his associates underscored the necessity for user-friendly interfaces, given the varied technical skill levels within their teams. They seemed impressed by the adaptability and ease of use that MG Advanced offers. The dinner provided a valuable opportunity to deepen our understanding of Betasoloin’s strategic objectives and identify how our offerings can support these goals.

Our next step is to schedule a technical demonstration for Joel’s IT department to further illustrate the capabilities of MG Advanced and address any queries they might have. Joel agreed that a hands-on session would be beneficial, and he will coordinate potential dates with his team. We'll follow up next week to finalize arrangements for this demonstration."
1001,Betasoloin,Joel Woods,Email,Completed,3/3/2024,"Joel responded with enthusiasm regarding the upcoming technical demonstration for Betasoloin's IT department. He expressed a need to explore how MG Special can seamlessly integrate with their existing systems and enhance user experience, emphasizing the importance of simplicity for their diverse team. Recognizing this, we provided a selection of dates for next week to conduct the demo, ensuring flexibility to accommodate their schedule. Joel also highlighted a few specific features they are interested in, such as the dashboard customization options and real-time data analytics capabilities.

To address these interests comprehensively, our team will prepare targeted examples and scenarios that resonate with Betasoloin’s operational goals. The demonstration will highlight not only integration and adaptability but also how our solution can streamline their workflow. We suggested a meeting next week to finalize the plan and brief their IT team in advance, ensuring the session is as productive as possible. Joel agreed to review the proposed dates with his team and promised to confirm by the end of the week. We eagerly anticipate solidifying these details and providing a robust overview of our offerings."
1001,Betasoloin,Joel Woods,Email,Scheduled,4/15/2024,"Joel,

I appreciate your enthusiasm for coordinating the technical demonstration of MG Advanced. To ensure we address Betasoloin's unique requirements effectively, I've attached a brief questionnaire regarding your IT team's primary focus areas and any specific challenges they face with current systems. This will allow us to tailor the demonstration, particularly focusing on dashboard customization and real-time analytics, which I believe will resonate with your strategic goals.

Let me know if the proposed dates for next week work or if adjustments are needed. Once confirmed, we'll finalize the session details and ensure our technical specialists are prepared to engage with your team. Looking forward to your prompt feedback so we can move these arrangements forward and deliver a compelling overview tailored to your team’s needs. Thank you for your continued collaboration.

Best regards,

[Your Name]"
1001,Betasoloin,Joel Woods,Meeting,Scheduled,6/3/2024,"During a brief call with Joel Woods, it was confirmed that Betasoloin’s IT department is available for the technical demonstration next Wednesday afternoon. Joel expressed particular interest in how GTX Pro and GTX Plus Basic could address their focus on improving data real-time analytics and customization features, which he noted are key priorities for Betasoloin's upcoming projects. He also appreciated the questionnaire sent earlier, indicating that the insights provided would be pivotal for our demonstration’s success.

To ensure a highly relevant session, we’ll tailor the presentation to highlight specific integration capabilities and ease of use that align with their strategic goals. Joel will ensure that key IT stakeholders attend, enhancing the opportunity to dive deeper into technical queries and directly address their operational needs. Our next step involves finalizing the demo script, incorporating Betasoloin's feedback from the questionnaire, and ensuring all technical aspects are prepared by early next week. Further communication with Joel will confirm any additional requirements or alterations they might propose before the demonstration."
1001,Betasoloin,Joel Woods,Meeting,Completed,7/8/2024,"In today's Zoom session, Joel confirmed his team's interest in exploring GTX Plus Pro's enhanced features, particularly its customization capabilities and real-time analytics. He reiterated the critical importance of demonstrating seamless integration with their existing systems, a point which will be pivotal in their decision-making process. Joel also provided useful insights from Betasoloin's IT department, emphasizing the need for a straightforward user interface that aligns with their operational workflows.

We discussed the upcoming demonstration, ensuring alignment on technical specifics to be highlighted. Joel appreciated our flexibility and suggested including a short segment on potential scenarios addressing their current operational challenges. He mentioned that the IT team's involvement is crucial, and they're eagerly anticipating the deep dive into integration specifics.

To enhance the demo's relevance, we'll immediately refine our script based on today's discussion, incorporating Joel’s suggestions. We agreed on a follow-up call early next week to review any last-minute adjustments and confirm all necessary technical arrangements. This proactive approach will ensure a comprehensive and targeted demonstration on Wednesday."
1001,Betasoloin,Joel Woods,Meeting,Completed,7/11/2024,"During a quick call with Joel Woods, he reiterated the importance of ensuring our demo aligns closely with Betasoloin's strategic priorities, particularly focusing on the seamless integration of GTX Pro into their existing infrastructure. Joel has requested that we delve deeper into the customization aspects of GTX Plus Basic, as this is a key interest for their IT team. He also mentioned the need for additional data on system performance metrics to better illustrate the product's capabilities to stakeholders. This aligns with their emphasis on a user-friendly and efficient interface that maintains high performance under various loads.

Next, our team will incorporate these specifications into the demo script. I'll collaborate with our technical team to gather the necessary metrics and refine the demo to better address these focal points. I’ll reach out to Joel again this Friday to confirm these additions, ensuring a presentation that meets Betasoloin's needs and enhances our competitive edge."
1002,Betatech,James Ware,Email,Completed,1/25/2024,"James,

Following up on our last discussion, I'm pleased to address the technical specifications you requested about the GTK 500. This product, designed with cutting-edge innovation, will seamlessly integrate with your existing systems, enhancing both efficiency and performance. The specific module you showed interest in not only boosts operational capacity but also aligns perfectly with Betatech's growth objectives.

I’ve attached a detailed breakdown of the features and how they compare to your current setup. This should provide clarity on the potential improvements in data processing speed and overall resource management. If there's anything more you need or specific concerns to address, please let us know. Additionally, I propose we arrange a call next week to go over any questions and ensure everything aligns with your strategic timeline. Your feedback will be invaluable in tailoring the final offer.

Looking forward to your thoughts.

Best regards,

[Your Full Name]
[Your Position]
[Your Contact Information]"
1002,Betatech,James Ware,Meeting,Completed,1/30/2024,"Following the town hall, I spoke briefly with James in the hallway. He expressed renewed interest in exploring how we might support Betatech's upcoming initiatives, particularly those focused on advancing their data processing capabilities. He is keen to see how the GTK 500 could be integrated into their current systems to enhance overall efficiency. Although compatibility remains a concern, James assured me that their tech team is ready to delve deeper into the specifics of system alignment. He suggested arranging a dedicated meeting between their tech leads and our integration specialists to tackle these hurdles directly. With this proactive approach, there is an opportunity to tailor our offering more precisely to Betatech's strategic objectives. I will coordinate with our tech team to propose suitable times for this discussion and ensure we address all technical considerations comprehensively. This meeting will be crucial in solidifying our position as a key partner in their growth strategy."
1002,Betatech,James Ware,Meeting,Scheduled,2/20/2024,"In a brief call with James Ware, the primary focus was on addressing Betatech's interest in integrating the GTK 500. He highlighted concerns about compatibility with their existing systems and mentioned that NexCore is positioning their solution as a seamless fit. To differentiate our offering, James suggested setting up a technical meeting to delve into the specific integration points. Both teams will benefit from this collaborative session, allowing our specialists to demonstrate the advanced capabilities of the GTK 500 and address potential hurdles. James emphasized the importance of this discussion for Betatech’s decision-making process, underscoring the necessity for a tailored approach. We are coordinating with our tech team to schedule this meeting early next week, ensuring our experts are well-prepared to present a compelling case that aligns with Betatech's growth strategies."
1002,Betatech,James Ware,Meeting,Scheduled,3/29/2024,"During our recent Zoom meeting with James, we explored specific compatibility concerns related to integrating the GTK 500 with Betatech's existing infrastructure. They are keen on ensuring a seamless transition without disrupting current operations, emphasizing the need for detailed technical support. We agreed to collaborate closely with their IT department to map out integration pathways, which will help in minimizing potential disruptions. Additionally, James showed enthusiasm for leveraging the GTX Basic as a complementary tool to optimize their resource management processes.

To move forward effectively, our tech team will craft a tailored integration plan addressing identified compatibility issues, set to present in our upcoming technical session next week. This will include an overview of potential challenges and solutions, ensuring alignment with Betatech’s operational timelines. The team is prepared to deliver a comprehensive demonstration highlighting the GTK 500's advanced features, focusing on how these can fulfill Betatech’s specific growth objectives. James anticipates reviewing this plan and assessing its impact, providing feedback to fine-tune our approach further."
1002,Betatech,James Ware,Email,Completed,4/11/2024,"Following James's recent inquiry, we've progressed significantly in refining our approach to ensure the GTK 500 aligns seamlessly with Betatech's operational framework. Our tech team is finalizing the integration plan, addressing the compatibility challenges we discussed. Next week’s technical meeting will include a detailed demonstration on how the GTK 500 can enhance data processing capabilities without disrupting existing systems.

Additionally, we’ve tailored a support package that prioritizes rapid response times and comprehensive coverage. This approach not only promises a smoother transition but also actively supports Betatech’s scalability goals, reinforcing our commitment to your long-term success. Before our meeting, please let us know if there are specific areas you'd like us to focus on or any additional stakeholders who should be involved. We're eager to ensure this partnership enhances your strategic initiatives effectively."
1002,Betatech,James Ware,Meeting,Scheduled,5/29/2024,"During lunch with James Ware at Betatech, we concentrated on finalizing the collaboration around the MG Special product. James expressed satisfaction with the progress our team has made in addressing their integration concerns, particularly the tailored solutions for their unique operational requirements. We delved into the specifics of the technical meeting scheduled for next week, where our experts will present a comprehensive demonstration of the MG Special’s capabilities, including the newly developed support package designed to ensure a seamless adoption process.

Importantly, James emphasized the need for assurances on scalability and long-term support, key aspects as Betatech anticipates significant growth in the coming quarters. We assured him that our team would provide extensive documentation and hands-on training to facilitate their team’s readiness. To ensure all bases are covered, James will introduce us to Betatech’s COO at the technical meeting, bringing another layer of oversight and depth to the discussions. Our next step is to refine the demonstration materials, preparing for any questions that might arise from the expanded stakeholder group, thereby strengthening our position as Betatech’s preferred technological partner."
